{
  "schemaVersion": 1,
  "gateId": "scale-500",
  "policyId": "recipe-production-pipeline-v1",
  "policyVersion": "1.0.0",
  "contractId": "ydm-v1-production-corpus",
  "contractVersion": "1.0.0",
  "snapshotId": "snapshot-1.0.0-production-scale-001-bcb4ffaee5c4",
  "activeRecipeCount": 220,
  "targetActiveRecipes": 500,
  "pilot": {
    "target": 120,
    "terminal": 120,
    "accepted": 120,
    "rejected": 0,
    "unresolvedReferenceRequests": 0,
    "unhandledReferenceDataProposals": 0,
    "complete": true
  },
  "checks": [
    {
      "id": "pilot-production-readiness",
      "status": "pass",
      "detail": "readyForPilot=true"
    },
    {
      "id": "pilot-terminal-count",
      "status": "pass",
      "detail": "terminal=120, target=120"
    },
    {
      "id": "pilot-unresolved-references",
      "status": "pass",
      "detail": "unresolved=0"
    },
    {
      "id": "pilot-reference-data-proposals",
      "status": "pass",
      "detail": "unhandled=0"
    },
    {
      "id": "snapshot-schema-errors",
      "status": "pass",
      "detail": "schemaErrors=0"
    },
    {
      "id": "snapshot-unknown-ingredients",
      "status": "pass",
      "detail": "unknownIngredientReferences=0"
    },
    {
      "id": "snapshot-nutrition-errors",
      "status": "pass",
      "detail": "nutritionErrors=0"
    },
    {
      "id": "snapshot-allergen-errors",
      "status": "pass",
      "detail": "allergenDerivationErrors=0"
    },
    {
      "id": "snapshot-locale-errors",
      "status": "pass",
      "detail": "missingRequiredLocaleFields=0"
    },
    {
      "id": "snapshot-exact-duplicates",
      "status": "pass",
      "detail": "exactDuplicateCount=0"
    },
    {
      "id": "snapshot-near-duplicates",
      "status": "pass",
      "detail": "nearDuplicateCount=0, max=0"
    }
  ],
  "coverageChecks": [
    {
      "targetId": "meal-breakfast-coverage",
      "releaseMinimum": 500,
      "requiredAtGate": 84,
      "actual": 20,
      "status": "blocked"
    },
    {
      "targetId": "meal-lunch-coverage",
      "releaseMinimum": 700,
      "requiredAtGate": 117,
      "actual": 70,
      "status": "blocked"
    },
    {
      "targetId": "meal-dinner-coverage",
      "releaseMinimum": 700,
      "requiredAtGate": 117,
      "actual": 60,
      "status": "blocked"
    },
    {
      "targetId": "meal-snack-coverage",
      "releaseMinimum": 350,
      "requiredAtGate": 59,
      "actual": 20,
      "status": "blocked"
    },
    {
      "targetId": "meal-mini_meal-coverage",
      "releaseMinimum": 150,
      "requiredAtGate": 25,
      "actual": 100,
      "status": "pass"
    },
    {
      "targetId": "practical-portable-coverage",
      "releaseMinimum": 300,
      "requiredAtGate": 50,
      "actual": 170,
      "status": "pass"
    },
    {
      "targetId": "cell-lunch-kcal-300-399",
      "releaseMinimum": 75,
      "requiredAtGate": 13,
      "actual": 5,
      "status": "blocked"
    },
    {
      "targetId": "cell-lunch-kcal-400-499",
      "releaseMinimum": 75,
      "requiredAtGate": 13,
      "actual": 5,
      "status": "blocked"
    },
    {
      "targetId": "cell-lunch-kcal-500-599",
      "releaseMinimum": 75,
      "requiredAtGate": 13,
      "actual": 13,
      "status": "pass"
    },
    {
      "targetId": "cell-lunch-kcal-600-699",
      "releaseMinimum": 75,
      "requiredAtGate": 13,
      "actual": 13,
      "status": "pass"
    },
    {
      "targetId": "cell-lunch-kcal-700-799",
      "releaseMinimum": 75,
      "requiredAtGate": 13,
      "actual": 10,
      "status": "blocked"
    },
    {
      "targetId": "cell-dinner-kcal-300-399",
      "releaseMinimum": 75,
      "requiredAtGate": 13,
      "actual": 5,
      "status": "blocked"
    },
    {
      "targetId": "cell-dinner-kcal-400-499",
      "releaseMinimum": 75,
      "requiredAtGate": 13,
      "actual": 4,
      "status": "blocked"
    },
    {
      "targetId": "cell-dinner-kcal-500-599",
      "releaseMinimum": 75,
      "requiredAtGate": 13,
      "actual": 13,
      "status": "pass"
    },
    {
      "targetId": "cell-dinner-kcal-600-699",
      "releaseMinimum": 75,
      "requiredAtGate": 13,
      "actual": 8,
      "status": "blocked"
    },
    {
      "targetId": "cell-dinner-kcal-700-799",
      "releaseMinimum": 75,
      "requiredAtGate": 13,
      "actual": 8,
      "status": "blocked"
    },
    {
      "targetId": "cell-breakfast-kcal-100-199",
      "releaseMinimum": 50,
      "requiredAtGate": 9,
      "actual": 1,
      "status": "blocked"
    },
    {
      "targetId": "cell-breakfast-kcal-200-299",
      "releaseMinimum": 50,
      "requiredAtGate": 9,
      "actual": 1,
      "status": "blocked"
    },
    {
      "targetId": "cell-breakfast-kcal-300-399",
      "releaseMinimum": 50,
      "requiredAtGate": 9,
      "actual": 2,
      "status": "blocked"
    },
    {
      "targetId": "cell-breakfast-kcal-400-499",
      "releaseMinimum": 50,
      "requiredAtGate": 9,
      "actual": 5,
      "status": "blocked"
    },
    {
      "targetId": "cell-snack-kcal-100-199",
      "releaseMinimum": 50,
      "requiredAtGate": 9,
      "actual": 0,
      "status": "blocked"
    },
    {
      "targetId": "cell-snack-kcal-200-299",
      "releaseMinimum": 50,
      "requiredAtGate": 9,
      "actual": 2,
      "status": "blocked"
    },
    {
      "targetId": "cell-snack-kcal-300-399",
      "releaseMinimum": 50,
      "requiredAtGate": 9,
      "actual": 4,
      "status": "blocked"
    },
    {
      "targetId": "cell-snack-kcal-400-499",
      "releaseMinimum": 50,
      "requiredAtGate": 9,
      "actual": 1,
      "status": "blocked"
    }
  ],
  "status": "ready",
  "blockers": [
    "coverage:meal-breakfast-coverage: actual=20, required>=84",
    "coverage:meal-lunch-coverage: actual=70, required>=117",
    "coverage:meal-dinner-coverage: actual=60, required>=117",
    "coverage:meal-snack-coverage: actual=20, required>=59",
    "coverage:cell-lunch-kcal-300-399: actual=5, required>=13",
    "coverage:cell-lunch-kcal-400-499: actual=5, required>=13",
    "coverage:cell-lunch-kcal-700-799: actual=10, required>=13",
    "coverage:cell-dinner-kcal-300-399: actual=5, required>=13",
    "coverage:cell-dinner-kcal-400-499: actual=4, required>=13",
    "coverage:cell-dinner-kcal-600-699: actual=8, required>=13",
    "coverage:cell-dinner-kcal-700-799: actual=8, required>=13",
    "coverage:cell-breakfast-kcal-100-199: actual=1, required>=9",
    "coverage:cell-breakfast-kcal-200-299: actual=1, required>=9",
    "coverage:cell-breakfast-kcal-300-399: actual=2, required>=9",
    "coverage:cell-breakfast-kcal-400-499: actual=5, required>=9",
    "coverage:cell-snack-kcal-100-199: actual=0, required>=9",
    "coverage:cell-snack-kcal-200-299: actual=2, required>=9",
    "coverage:cell-snack-kcal-300-399: actual=4, required>=9",
    "coverage:cell-snack-kcal-400-499: actual=1, required>=9",
    "active-recipe-count: active=220, required>=500"
  ],
  "evaluatedAt": "2026-09-04T19:43:49.891Z"
}
